Page Number,Title,Description
9, Design & Laser Cut Jewelry with Rhino,"Dive in Rhino (a 3D modeling program) to create jewelry designs ready to be cut by a laser cutter.
You do not need to have experience with Rhino itself, but experience with at least one modeling software (Rhino, OnShape, Fusion360, TinkerCAD, etc..) is recommended in order to follow this course comfortably.
 "
10, UX Research: Discovery,"This class meets once a week (same day same time) for 2 weeks! You can sign up for 1 or both classes, but please note that the second class (September 22, 2023) builds upon the knowledge you will learn in the first class (September 15, 2023).
 
This series provides a high-level overview of user experience research methods typically used in the discovery phase of a project, product, or service. Discovery research helps you learn what problems to solve and which design directions to take. You will work on fun activities in small groups focusing on interviewing, analyzing interview transcripts, and prioritizing themes you find in the interviews."
10, Designing for Users: Overview of UX/UI,"User Experience strategies can improve any product by promoting a user-centered design mentality - ensuring what is delivered will best benefit the end-user. This class is an overview of both User Experience and User Interface Design and outlines how both are core steps to producing excellent digital products. This class will introduce different steps and aspects of designing websites and apps incorporating good UX/UI.
This is an introductory class. No experience in design or software needed."
10, Make Your Own Silicone Mold,"Take a positive 3D modeled shape to create a negative silicone mold which you can then use for future projects, including soap making or other casting applications."
10, Flask Fundamentals,Flask is a lightweight framework that we use in order to create lightweight python web applicatons. This course will teach you how to get up and running with a basic flask app.
10, First Steps Into Graphic Design: Intro to InDesign,"If you've never seen Adobe InDesign and want to get more familiar with the tools before taking another Roots workshop about creating with InDesign, this is the course for you! We will go over the purpose of InDesign and the tools most often used. By the end of this class, you will be able to place shapes, text, and images in InDesign and know where to find answers to questions you may have as you continue to learn InDesign.
This is an introductory class and is aimed at students who do not know InDesign at all or haven't opened the program in a long time."
11, Make Your Own Soap,"Soap... We all use it. Soap is the most important invention in human history but do you know where it comes from or how it’s made? Join us in this fun arts and crafts class where we learn how to make sudsy bars of usefulness. We’ll also learn how modern tools like 3D printing and online chemistry calculators can improve on this age-old process. This is a get-your-hands-dirty...err clean...class! Participants will have their very own bars at the end of the two sessions workshop. We will provide 1 soap making kit per pair of students, all the gear to get you started and a few varieties of fragrances and dyes. If you would like a specific scent for your soap, feel free to bring your own essential oils."
11, The Visual Design Process,This workshop will introduce you to one approach to visual design. Join UI designer Jen Hubbard as she walks you through the steps she takes in completing visual design projects here at Duke.
11, SQL – Beyond the Basics (1/3),"This course will provide an introduction to intermediate SQL concepts, including data manipulation with built-in arithmetic and date functions, set operations, and nested queries. The skills gained in this course will allow users to answer a variety of questions about their data.
 "
11, Make a Monster,Want to make your own Duke themed plushie?! Come to this workshop to develop your sewing skills (hand and machine) and create a terrifyingly adorable monster. We will also provide you with some LEDs for some extra fun!
11, Intro to Docker,"This course is designed to give you a foundation to begin working with the Docker containerization platform. By the end of the course, you will have a fundamental understanding of how to create Docker containers, how they function, and the main reasons to use containerization in your application development process."
12, Implementing Deep Learning Models in Tensorflow,"In this workshop we will learn how to use the popular deep learning library, Tensorflow, to build and train a simple neural network for image classification. This is a zero-entry workshop that assumes no previous experience with Tensorflow."
12, Logo Design with Illustrator,"All businesses need a logo! In this class, we will go over the different types of logos out there and discuss tips and tricks on what to do and what not to do. We will then create a logo together based on the different brand guides created in a previous workshop, using paper and pencil before moving on to Illustrator. This class assumes that you have opened Illustrator before and know where most tools are located in the interface."
12, How to Program with Ruby (combined)," 
This class is a combined version of How to Program with Ruby (1/2) and How to Program with Ruby (2/2).
Ruby is a modern object oriented programming language used in many tech stacks in the industry. Created by Yukihiro Matsumoto in 1995; Ruby has evolved into a widely adopted for its readability and ease of use to those learning a programming language. This class will touch on several fundamental concepts of Ruby programming.
This class will be hosted via Zoom. You will receive an email with the Zoom link a day before the class. Attendance will be taken and the session will be recorded.
 "
12, Intro to mySQL,"Take this class to learn more about databases. This course will provide students with a basic introduction to the popular open source Database Management System (DBMS) named “MySQL”.
 
 

 
InstructorMary Clair Thompson | Office of Information TechnologyI am a Data Engineer and Data Scientist on OIT’s Data Analytics team, with previous industry experience working with big data in the cloud.
This class will be hosted via Zoom. You will receive an email with the Zoom link a day before the class. Attendance will be taken and the session will be recorded.
 "
12, Advanced Sewable Circuits," 
Fashion meets tech. Sewable circuits are simple circuits that bring clothing and accessories to life. We'll show you how to create a simple circuit and program them using a Lilypad micro-controller. Bring an article of clothing/accessory to couple with interactive interactive LED's.
 "
13, Intro to Databases & MySQL,"Come to this course to learn about databases and their importance across a multitude of fields. This class will provide students with a basic introduction to what databases are and how to interact with them, before diving into a basic introduction to the popular open source Database Management System (DBMS) named “MySQL”.
 

 "
13, Introduction to Toolpathing in Fusion360,"Introduction to Toolpathing in Fusion 360 continues down the path of feature exploration where students can expect to learn more about features of the tool for machining on popular CNC devices like the CoLab’s Tormach and ShopBot mills.  Often computer aided manufacturing (CAM) software tools are standalone products, Fusion 360 integrates those functions in to a simple-to-use interface. For those who already have CAD experience, Introduction to Toolpathing in Fusion 360 does not require prior completion of our Roots CAD classes. The instructor will demystify the world of computer aided manufacturing by leading the class through three examples of water jet cutting, CNC routing and CNC milling with CAD models provided.
 "
13, Intro to APIs?,"API is one of those terms we hear thrown around in the tech world a lot, but what are they? APIs are how our applications talk and interact with one another. In this workshop we will learn the basics of using a REST API over the web.
 
 "
13, Using InDesign for your Graphic Projects: Document Layout,"After taking an introductory course in InDesign, you may want to practice your skills. In this course, you will use InDesign and grids to create a quality project you can use for your organizations."
13, Intro to R,"Are you interested in data visualization and data analysis? Do you have large datasets but need a tool to help you clean up the data? You should learn R with RStudio! In this workshop, we will cover basic setup, concepts, syntax and conditionals in R, an open source programming language for statistical computing. We'll go through a series of exercises step by step. This is an intro-level workshop, so no coding background needed. See you in class!
 
Slides: link "
14, Creating WebXR Experiences with Babylon.js,"There are many tools we can use to create VR experiences. In this workshop we will talk about VR experiences that are served out as webpages, hence WebVR or WebXR. While slightly less performant that native apps, the advantages of WebXR include easy onboarding and app distribution: we just send someone a link, no need to get on an approved app store! Another benefit is that non-VR users can easily explore our virtual worlds on their computers. In this workshop we will start with learning how to use the Co-Lab's VR headsets and then build up to creating and experiencing a simple virtual world."
14," SQL – Grouping, Joins, and Aggregations (2/3)","This course will provide an introduction to a few advanced sql concepts, including grouping and aggregations. Users will also learn the differences between the various types of joins.
 "
14, Intro to JavaScript,"What is Javascript? Is it related to Java? What is vanillaJS? Is it hard to learn? I know you have many questions, and this workshop is here to help you bust these myths. Javascript is a front-end development language. It can help you build a website and make it interactive much simpler than plain HTML. This is part one of the JS courses. We'll focus on the basic JS Syntax, how to declare a variable, how to create a function in this course. Let's get started!
 
Repo: link
Slides: link
Edstem: link1, link2"
14, Make Your Own Furniture Using CNC,"This class meets once a week (same day same time) for 4 weeks! When signing up, you are signing up for all 4 sessions.
Come make your own furniture using the shoptbot and other woodworking tools and techniques."
14, Create a Website: Interactivity with Javascript," 
Take your own website, and bring it to life! In this workshop, we'll take the website you've been working on throughout the 'Create a Website' courses, and add dynamic features like sorting, hiding/showing displays, and image manipulation to turn your static pages into living documents. If you have missed a class or two, don't worry - we'll provide a sample page for you to get up and running in this workshop, so feel free to sign up even if you haven't been to any of the other classes!"
15, Introduction to Unity,"Unity is game engine popular for making indie games (Kerbal space program), mobile/phone apps (Pokemon Go), and Virtual Reality games (Beat Saber). In this introduction we will learn about the interface of the Unity editor, add some objects into our world, and finally build out to a standalone desktop app."
15, Advanced CSS: Get to know Grid and Shape,"If you've done some CSS before, you know how much of a pain it is to place things just so... You've tried all the tricks, you've done all the math, and yet you can never get your layout exactly the way you were envisioning on paper... or you could but you had to try a million combinations or write what felt like a million lines of code. You are a wizard and CSS is magic... let Grid become your wand of supple wood with a phoenix core, and harness that power! Grid allows you to place things horizontally, vertically anywhere and everywhere, however you like, whenever you like. Want to move your footer in the middle of the page when your screen is between 800px and 1200px wide without using javascript ? You can! Want to have everything divided into 12 exact columns without worrying about margins and paddings and making mad calculations? You can! Want a grid within a grid within a grid? You can! This class is for made for the CSS enthusiast, or the downright frustrated CSS user who just would like to kill floats with fire. Intermediate understanding of CSS is expected to follow this class comfortably. If you do not know CSS, or haven't worked with it in a while, we suggest taking our Create a Website: Styling and Create a Website: Layout classes beforehand.
CSS Shapes is a more recent addition to the CSS family. This cluster of CSS rules will allow you to have greater control over the way text display next to an image. Come to this workshop to learn how to make it follow a curve or create new shapes to build dynamic compositions on the web. A good understanding of CSS is recommended for this class. If that does not sound like you, try and take Create a Website: Styling and Create a Website: Layouts before this one."
15, Write Your First Python Script,"The natural continuation of our Python Basics class, come join us as we write a basic functioning script using python.
In order to follow this class comfortably, we recommend you have basic experience with at least one programming language (python or other)."
15, Create a Website: Styling (Intro to CSS),"So you have created an HTML file, and it holds all your content, but it's lacking inspiration. It is time to add color to your world! In this second class in our Create a Website series, we are introducing a new language: CSS. CSS is the styling language for the web and it can make ""most"" of our web styling related dreams come true! With that said, CSS is a vast language with loads of possibilities and just like with everything, we must start small to one day go big. This class is geared towards CSS beginners, who have done some HTML work in the past. If you have never touched HTML before, we recommend you first take the Create a Website: Structure class to get all caught up. In this class, you will learn the basics of CSS, the styling language of the web. We will explore CSS usage, its syntax and best practices when it comes to CSS file setups. We will also look into key features of CSS such as the cascading model, and the specificity model. Finally we will put all that into practice by styling a simple web page using Codepen.io"
15, CSS Deep Dive: CSS Animations,"Disclaimer: this is not a CSS beginner class. You need to know HTML and CSS (functionality and syntax) to take this class.  Want to have super cool animated effects on your web pages without having to use JavaScript, gifs or videos? Well, look no further than this class, where you will get an introduction to the different types of CSS animations you can use. This class will cover the bases of animating for the web, including best practices, types of animations and syntax. We will then dive into ""Transforms"" and create a few simple animations. If time allows, we will create a more complex animation using what we have just learned at the end of the class."
16, Create a Website: CSS Layouts,"You are getting the hang of those basic CSS rules, and even though your site is starting to look good, you feel like you could do more. If this is you, then this class is for you. We will not be diving into completely uncharted territory, but we will build upon what was done in the Create a Website: Styling workshop. In this class, we will talk about why responsiveness is the way to design any site. We will look into the different markers that make up a responsive site, before diving into the different ways to change a layout (displays, floats, flexbox, grid). Finally we will work on a couple of exercises to get comfortable with the new concepts taught in the class. This class assumes that you have some basic knowledge of HTML and CSS."
16, SQL – Temporary Tables and Windows (3/3),"This course will show students how to create and use temporary tables when constructing queries, and provide an introduction to the concept of windowing. Students will also learn how to apply bounds to their windows for advanced data analysis."
16, Intro to React,"If you have experience in HTML, CSS and Javascript, and you want to learn a framework to make it easier to organize website structure, you're at the right place. React is a free and open source Javascript library that helps you build user interface. It is maintained by Facebook and the web dev community.
Instructor:Anni Yan | Innovation Co-Lab Developer & InstructorAnni is a recent grad from Duke University, and she is working at the Co-Lab now. She is passionate about data visualization, game designs and web development. Outside of work, Anni loves to hangout with Yuki (her cat), bake and play games."
16, Intro to Arduino,Introduction to Arduino is a beginner-level class that will introduce participants to the exciting world of physical computing. Participants will learn about how to use microcontrollers in a hands-on workshop. We'll work from examples in the Arduino library to make an interactive LED and music project. No prior experience necessary. 
16, Intro to Python,"Welcome to the Intro to Python class -- this is a class intended for people with little to no programming experience who want to learn introductory programming. We will be working in class on basic programming concepts such as variables, input, output, strings, loops, and more -- if you've never programmed before and want to learn some basics, this is the class for you!
 "
17, Make Simple 3D Models & Toolpathing with Fusion360,"This class meets once a week (same day same time) for 2 weeks! When signing up, you are signing up for all 2 sessions.
Day 1:
This class will focus on the learning basic modeling concepts using the Fusion360 tool.  Fusion360 is a powerful and emerging tool in the modeling business that combines features found in tools targeted toward many different 3D industries.  This “many features in one tool” approach makes it a great Swiss Army Knife for general 3D practitioners.  In this class we will focus on the basic interface and create solid models through several exercises including designing our own Machinists Cube, a classic ""Hello World"" project. The class will also cover multi-part assemblies by modeling a simple box with sliding lid.
Day 2:
Introduction to Toolpathing in Fusion 360 continues down the path of feature exploration where students can expect to learn more about features of the tool for machining on popular CNC devices like the CoLab’s Tormach and ShopBot mills.  Often computer aided manufacturing (CAM) software tools are standalone products, Fusion 360 integrates those functions in to a simple-to-use interface. For those who already have CAD experience, Introduction to Toolpathing in Fusion 360 does not require prior completion of our Roots CAD classes. The instructor will demystify the world of computer aided manufacturing by leading the class through three examples of water jet cutting, CNC routing and CNC milling with CAD models provided."
17, When Pumpkins Meet Power Tools,"What more do you need to know beyond the title?? We will be carving up pumpkins with a variety of handheld power tools! We will provide the pumpkins, power tools, some non-power tools, and safety glasses. You bring your creativity and potentially clothes that aren't your very best, just in case!
To ensure everyone gets the most out of the workshop, we can only have 6 people join us at a time.  The workshop will be divided into 4 time slots of 1h between 1pm and 5pm. You will receive an email a day before the event assigning you a time slot.
 "
17, E-Textiles: Light Up Your Clothing,"Technology is all around us in our daily lives, and we augment our own senses and experiences with tech like smartphones and smart watches, but how could we integrate those electronics into our clothes?
E-Textiles I covers a basic introduction to sewing and circuitry using conductive thread and LEDs, no experience required! We'll be sewing by hand, and all materials will be provided. Each attendee will be able to bring their circuit home with them!
Kits will provide you with everything you need to make a felt bracelet with multiple LEDs. With that said, you are free to design and make anything else you may want, especially if you would prefer adding the circuits to clothing or fabric accessories you already own!"
17, Intro to Shiny,"Shiny is a package that helps you develop web pages in an R environment. Using Shiny lets people, with no knowledge of R, interact with your data, models and results on a web page. In this workshop, hosted by the Innovation Co-Lab, learn how to interactively tell your research story and migrate your important work and results in R and RStudio to the Web.
We'll also be covering the very basics of front-end development. If you don't have any front-end development experience but had some experience in R, this would be the perfect workshop for you. "
17, Epoxy Pouring: Make Your First Resin Coasters,"Popular for making everything from jewelry, to dishes, to decorating counters, and more, learn the basics of using Epoxy Resin to make beautifully expressive and unique artworks."
18, Singularity Containers,"This workshop provides researchers in the humanities, arts, and sciences an opportunity to become familiar with containerization tools, which are in wide use in the research computing world. The workshop will introduce the tools and provide hands-on experience. Researchers with software they want to package -- or ""containerize"" -- for use on the cluster or elsewhere will be able to do so. We will introduce Gitlab-CI (https://about.gitlab.com/features/gitlab-ci-cd/) and Singularity (https://sylabs.io) and tools that OIT programmers have built to automate the production of ""cluster-ready"" Singularity containers. Who should take part? Users of the Duke Compute Cluster; researchers who are using software with specific and perhaps exotic library dependencies; researchers who are using computers at other locations, including XSEDE supercomputers, Open Science Grid (OSG), or computers shared with colleagues at other institutions, researchers who want to increase the likelihood that their computational methods are transportable and reproducible. Time will be available for participants to ask questions about building their own containers."
18, High Performance Computing and the Duke Compute Cluster,"The Duke Compute Cluster (DCC) is a general purpose, high performance, Linux computing cluster with software used for a broad array of scientific projects. The DCC is made up of machines that the University has provided for community use and researchers have purchased to conduct their research. This workshop will provide Duke University researchers with a brief overview of Research Computing resources including the Duke Compute Cluster. The majority of the session will be a hands on tutorial using the Duke Compute Cluster: running interactive and batch jobs, using slurm job arrays, running multi-cre and parallel jobs, and specifying job dependencies. There is time at the end for questions and help on existing jobs.
Please note: students attending this class should already have access to the DCC. For more information on the DCC, including how to obtain access, visit: rc.duke.edu This course will be online via Zoom, link will be provided to registrants the day before the session."
18, Understanding Object Oriented Programming,"This course is designed to help give you a better understanding of objects and object oriented programming(OOP). We will use python as our tool of choice, but know that these concepts translate into other OOP languages (ruby, javscript, etc.)"
18, Introduction to Deep Learning  Models with Tensorflow,"In this workshop we will give you an introduction to deep learning. We will also introduce the popular deep learning library, Tensorflow, and describe how to build, train, and test a simple model using this framework. This is a zero-entry workshop that assumes no prior knowledge."
18, Organizing UX Research with Information Architecture & User Flows,"This class meets twice (Friday, September 29, 2023 and Friday, October 13, 2023)! You can sign up for 1 or both classes, but please note that the second class (October 13, 2023) builds upon the knowledge you will learn in the first class (September 29, 2023).
 
Learn how to organize the information you uncovered during the Discovery phase of UX research through this overview of information architecture and user flows. You will work in small groups on activities to help you practice information architecture skills. This workshop also provides information on content priorities and how to start creating user flows."
19, Validate Your Design with Usability Testing,Put your design to the test and check if your ideas make as much sense to your users as they do to you (and your team). See how usability testing is done in professional circles and learn how to apply the same methodologies to your personal projects. You will work in small groups to practice the main steps involved in usability testing.
19, Coding in Unity (C#),"Unity is popular lightweight game engine that has been used to make such hits as pokemon go, kerbal space program, and beat saber. This class builds on the ""Intro to Unity"" roots course, that is offered earlier. In this course we will delve in scripting in C# which will allow to produce projects that are interactive."
